id,category,query,answer,expected_answer,faithfulness,faithfulness_notes,relevance,relevance_notes,context_recall,context_recall_notes,completeness,completeness_notes,config_label
gq06,Cross-Document,"Lúc 2 giờ sáng xảy ra sự cố P1, on-call engineer cần cấp quyền tạm thời cho một engineer xử lý incident. Quy trình cụ thể như thế nào và quyền này tồn tại bao lâu?","- Quy trình cấp quyền tạm thời cho engineer trong sự cố P1:
  1. On-call IT Admin có thể cấp quyền tạm thời (tối đa 24 giờ) sau khi được Tech Lead phê duyệt bằng lời [1].
  2. Sau 24 giờ, phải có ticket chính thức hoặc quyền sẽ bị thu hồi tự động [1].
  3. Mọi quyền tạm thời phải được ghi log vào hệ thống Security Audit [1].

- Thời gian quyền tạm thời tồn tại: tối đa 24 giờ [1].","On-call IT Admin có thể cấp quyền tạm thời (tối đa 24 giờ) sau khi được Tech Lead phê duyệt bằng lời. Sau 24 giờ, phải có ticket chính thức hoặc quyền bị thu hồi tự động. Mọi quyền tạm thời phải được ghi log vào hệ thống Security Audit. Liên hệ on-call qua hotline ext. 9999 (24/7) theo SLA P1.",5,"Every claim in the answer is directly supported by the retrieved context from it/access-control-sop.md. The steps for temporary access granting, the 24-hour limit, requirement for verbal approval from Tech Lead, need for a formal ticket after 24 hours or automatic revocation, and logging in Security Audit are all explicitly mentioned in the context.",5,"The answer directly and completely addresses both parts of the question: it outlines the specific process for granting temporary access during a P1 incident (including approval, duration, and logging), and clearly states the maximum duration of the temporary access (24 hours).",5,Retrieved: 2/2 expected sources,4,"The model answer covers all procedural and time limit details, but omits the specific instruction to contact on-call via hotline ext. 9999 (24/7) according to SLA P1. This is a minor but explicit point in the expected answer.",variant_hybrid
gq07,Insufficient Context,Công ty sẽ phạt bao nhiêu nếu team IT vi phạm cam kết SLA P1?,Không đủ dữ liệu trong tài liệu hiện có.,"Tài liệu hiện có không quy định mức phạt hay hình thức xử lý khi vi phạm SLA P1. Tài liệu sla-p1-2026.pdf chỉ mô tả quy trình xử lý và SLA target, không có điều khoản về penalty.",5,"The answer correctly states that there is not enough data in the provided documents to answer the (unspecified) question. This is fully faithful to the context, as it does not make any unsupported claims.",5,"The answer directly addresses the question by stating that there is not enough data in the available documents to determine the penalty amount, which is a complete and relevant response given the information constraints.",,No expected sources,3,"Model answer chỉ nói chung chung là không đủ dữ liệu, nhưng không chỉ rõ rằng tài liệu không quy định mức phạt, cũng không nhắc đến nội dung cụ thể của tài liệu như expected answer.",variant_hybrid
gq08,HR Policy,Nhân viên phải báo trước bao nhiêu ngày để xin nghỉ phép năm? Con số này có giống với số ngày cần giấy tờ khi nghỉ ốm không?,"- Nhân viên phải báo trước ít nhất 3 ngày làm việc để xin nghỉ phép năm [2].
- Số ngày cần giấy tờ khi nghỉ ốm là nếu nghỉ trên 3 ngày liên tiếp [1]. Không có thông tin so sánh giữa số ngày báo trước nghỉ phép năm và số ngày cần giấy tờ khi nghỉ ốm.",Nghỉ phép năm cần báo trước ít nhất 3 ngày làm việc qua HR Portal. Nghỉ ốm cũng liên quan đến mốc 3 ngày: nếu nghỉ TRÊN 3 ngày liên tiếp thì cần giấy tờ y tế từ bệnh viện. Hai con số '3 ngày' này áp dụng cho hai tình huống khác nhau.,5,Every claim in the answer is directly supported by the retrieved context. The requirement to notify at least 3 working days in advance for annual leave is stated in the policy. The need for medical documentation when sick leave exceeds 3 consecutive days is also explicitly mentioned. The answer correctly notes that there is no information comparing the advance notice for annual leave and the days requiring documentation for sick leave.,4,"The answer correctly states the required notice period for annual leave (3 working days) and explains the documentation requirement for sick leave (if over 3 consecutive days). However, it could be clearer in directly comparing the two numbers, as the question asks if they are the same. The answer says there is no information comparing them, but in fact, the numbers are given and can be compared.",5,Retrieved: 1/1 expected sources,4,"Model answer đã nêu đúng các mốc 3 ngày cho nghỉ phép năm và nghỉ ốm, nhưng thiếu chi tiết về việc báo nghỉ phép năm qua HR Portal và chưa làm rõ rằng hai mốc 3 ngày này áp dụng cho hai trường hợp khác nhau.",variant_hybrid
gq09,IT Helpdesk,"Mật khẩu tài khoản công ty cần đổi định kỳ không? Nếu có, hệ thống sẽ nhắc nhở trước bao nhiêu ngày và đổi qua đâu?","- Mật khẩu tài khoản công ty cần đổi định kỳ, cụ thể là mỗi 90 ngày [1].
- Hệ thống sẽ nhắc nhở trước 7 ngày khi mật khẩu sắp hết hạn [1].
- Thông tin về việc đổi mật khẩu không có trong tài liệu hiện có.","Có. Mật khẩu phải được thay đổi mỗi 90 ngày. Hệ thống sẽ nhắc nhở 7 ngày trước khi hết hạn. Để đổi mật khẩu, truy cập https://sso.company.internal/reset hoặc liên hệ Helpdesk qua ext. 9000.",4,"Hai thông tin đầu tiên về việc mật khẩu cần đổi định kỳ mỗi 90 ngày và hệ thống sẽ nhắc nhở trước 7 ngày đều được xác nhận trong context. Tuy nhiên, câu cuối cùng ('Thông tin về việc đổi mật khẩu không có trong tài liệu hiện có') là không chính xác, vì thông tin này thực sự có trong context. Do đó, một chi tiết nhỏ không chính xác, nên chấm 4 điểm.",4,"The answer addresses the question by stating that the password must be changed every 90 days and that the system will remind users 7 days in advance. However, it does not specify where or how to change the password, only mentioning that this information is not available in the current documentation. This omission of a minor detail prevents a perfect score.",5,Retrieved: 1/1 expected sources,3,"Model answer đã trả lời đúng về việc mật khẩu cần đổi định kỳ mỗi 90 ngày và hệ thống sẽ nhắc nhở trước 7 ngày. Tuy nhiên, phần hướng dẫn cụ thể về cách đổi mật khẩu (đường dẫn và liên hệ Helpdesk) bị thiếu, đây là một điểm quan trọng trong câu trả lời.",variant_hybrid
gq10,Refund,Chính sách hoàn tiền hiện tại áp dụng cho đơn hàng đặt trước ngày 01/02/2026 không?,"- Chính sách hoàn tiền hiện tại áp dụng cho tất cả các đơn hàng được đặt trên hệ thống nội bộ kể từ ngày 01/02/2026. Các đơn hàng đặt trước ngày này sẽ áp dụng theo chính sách hoàn tiền phiên bản 3 [1].
- Không đủ dữ liệu trong tài liệu hiện có.",Không. Chính sách hoàn tiền phiên bản 4 có hiệu lực từ ngày 01/02/2026 và chỉ áp dụng cho các đơn hàng được đặt kể từ ngày đó. Các đơn hàng đặt trước ngày này sẽ áp dụng theo chính sách hoàn tiền phiên bản 3.,5,"Every claim in the answer is directly supported by the retrieved context. The answer accurately states the effective date of the refund policy and the application of version 3 for earlier orders, both of which are explicitly mentioned in the context. The statement 'Không đủ dữ liệu trong tài liệu hiện có' (Not enough data in the current document) is a neutral statement and does not introduce unsupported information.",5,"The answer directly and completely addresses the question by clarifying that the current refund policy applies only to orders placed from 01/02/2026 onwards, and that orders placed before this date follow the previous policy (version 3). It also notes the lack of further data, which is relevant and transparent.",5,Retrieved: 1/1 expected sources,4,"Model answer đã giải thích rõ ràng về thời điểm áp dụng của chính sách hoàn tiền hiện tại và đề cập đến việc các đơn hàng trước ngày 01/02/2026 áp dụng phiên bản 3. Tuy nhiên, model answer không trả lời trực tiếp bằng từ 'Không' như expected answer, đây là một điểm nhỏ bị thiếu.",variant_hybrid
